{
  "$schema": "./Schema.RootSignature.json",
  "Name": "DefaultRootSignature",
  "Flags": [
    "AllowInputAssemblerInputLayout",
    "CBVSRVUAVHeapDirectlyIndexed"
  ],
  "Parameters": [
    {
      "Type": "Constants",
      "ShaderVisibility": "All",
      "Constants": {
        "ShaderRegister": 1,
        "RegisterSpace": 0,
        "Num32BitValues": 12
      }
    }
  ],
  "StaticSamplers": [
    {
      "Filter": "Anisotropic",
      "AddressU": "Wrap",
      "AddressV": "Wrap",
      "AddressW": "Wrap",
      "MipLODBias": 0.0,
      "MaxAnisotropy": 1,
      "ComparisonFunc": "Always",
      "BorderColor": "OpaqueBlack",
      "MinLOD": 0.0,
      "MaxLOD": 3.402823466e+38,
      "ShaderRegister": 0,
      "RegisterSpace": 0,
      "ShaderVisibility": "Pixel"
    },
    {
      "Filter": "ComparisonMinMagLinearMipPoint",
      "AddressU": "Clamp",
      "AddressV": "Clamp",
      "AddressW": "Clamp",
      "MipLODBias": 0.0,
      "MaxAnisotropy": 1,
      "ComparisonFunc": "LessEqual",
      "BorderColor": "OpaqueWhite",
      "MinLOD": 0.0,
      "MaxLOD": 3.402823466e+38,
      "ShaderRegister": 1,
      "RegisterSpace": 0,
      "ShaderVisibility": "Pixel"
    }
  ]
}
